[{"canonical_id":"banana","certification_name":"產銷履歷示範","certification_status":"active","org_id":"DEMO-001","pack_date":"2026-08-23","place":"屏東縣","producer":"示範合作社（fixture）","product_name_raw":"香蕉","record_type":"traceability_registry_lot","retrieved_at":"2026-09-03T00:00:00Z","schema_version":"2.0","semantic_warning":"此為同品項的公開產銷履歷紀錄，非本日市場成交來源證明。","source_id":"moa_traceability_7556","source_role":"authoritative_registry","source_status":"fixture","source_updated_date":null,"source_url":"https://data.moa.gov.tw/open_detail.aspx?id=063","tracecode":"DEMO-BANANA-001","valid_date":"2026-12-31"},{"canonical_id":"cucumber","certification_name":"產銷履歷示範","certification_status":"active","org_id":"DEMO-004","pack_date":"2026-08-24","place":"雲林縣","producer":"示範蔬菜班（fixture）","product_name_raw":"胡瓜","record_type":"traceability_registry_lot","retrieved_at":"2026-09-03T00:00:00Z","schema_version":"2.0","semantic_warning":"此為同品項的公開產銷履歷紀錄，非本日市場成交來源證明。","source_id":"moa_traceability_7556","source_role":"authoritative_registry","source_status":"fixture","source_updated_date":null,"source_url":"https://data.moa.gov.tw/open_detail.aspx?id=063","tracecode":"DEMO-CUCUMBER-001","valid_date":"2026-12-31"},{"canonical_id":"dragon-fruit","certification_name":"產銷履歷示範","certification_status":"unknown","org_id":"DEMO-003","pack_date":null,"place":"彰化縣","producer":"示範農場（fixture）","product_name_raw":"紅龍果","record_type":"traceability_registry_lot","retrieved_at":"2026-09-03T00:00:00Z","schema_version":"2.0","semantic_warning":"此為同品項的公開產銷履歷紀錄，非本日市場成交來源證明。","source_id":"moa_traceability_7556","source_role":"authoritative_registry","source_status":"fixture","source_updated_date":null,"source_url":"https://data.moa.gov.tw/open_detail.aspx?id=063","tracecode":"DEMO-DRAGON-001","valid_date":null},{"canonical_id":"pineapple","certification_name":"產銷履歷示範","certification_status":"active","org_id":"DEMO-002","pack_date":"2026-08-22","place":"嘉義縣","producer":"示範合作社（fixture）","product_name_raw":"鳳梨","record_type":"traceability_registry_lot","retrieved_at":"2026-09-03T00:00:00Z","schema_version":"2.0","semantic_warning":"此為同品項的公開產銷履歷紀錄，非本日市場成交來源證明。","source_id":"moa_traceability_7556","source_role":"authoritative_registry","source_status":"fixture","source_updated_date":null,"source_url":"https://data.moa.gov.tw/open_detail.aspx?id=063","tracecode":"DEMO-PINEAPPLE-001","valid_date":"2026-12-31"},{"canonical_id":"water-spinach","certification_name":null,"certification_status":"unknown","org_id":"DEMO-005","pack_date":null,"place":"高雄市","producer":"示範蔬菜班（fixture）","product_name_raw":"蕹菜","record_type":"traceability_registry_lot","retrieved_at":"2026-09-03T00:00:00Z","schema_version":"2.0","semantic_warning":"此為同品項的公開產銷履歷紀錄，非本日市場成交來源證明。","source_id":"moa_traceability_7556","source_role":"authoritative_registry","source_status":"fixture","source_updated_date":null,"source_url":"https://data.moa.gov.tw/open_detail.aspx?id=063","tracecode":"DEMO-WATER-SPINACH-001","valid_date":null}]